<?xml version="1.0" encoding="UTF-8"?>
<?xml-stylesheet type="text/xsl" href="hurtownia.xsl"?>

<!--Tylko tabela napojów-->
<!--<?xml-stylesheet type="text/xsl" href="napoje.xsl"?>-->

<!--Tylko tabela dostawców-->
<!--<?xml-stylesheet type="text/xsl" href="dostawcy.xsl"?>-->

<!--Tylko tabela producentów-->
<!--<?xml-stylesheet type="text/xsl" href="producenci.xsl"?>-->

<hurtownia xmlns:xsi="http://www.w3.org/2001/XMLSchema-instance" xsi:noNamespaceSchemaLocation="hurtownia.xsd">
	<napoje>
		<napoj id="1" rodzaj="Sok">
			<nazwa>Kubuś</nazwa>
			<producent>Maspex</producent>
			<dostawcaID>1</dostawcaID>
			<gaz>niegazowany</gaz>
			<smak>jabłkowy</smak>
			<ilosc>3500</ilosc>
			<cena>2.1500</cena>
			<opis>Nowe opakowanie</opis>
		</napoj>
		<napoj id="2" rodzaj="Sok" nieaktualne="true">
			<nazwa>Kubuś</nazwa>
			<producent>Maspex</producent>
			<dostawcaID>1</dostawcaID>
			<gaz>niegazowany</gaz>
			<smak>bananowy</smak>
			<ilosc>3500</ilosc>
			<cena>2.1500</cena>
		</napoj>
		<napoj id="3" rodzaj="Napój">
			<nazwa>Mirinda</nazwa>
			<producent>Pepsi</producent>
			<dostawcaID>2</dostawcaID>
			<gaz>gazowany</gaz>
			<smak>gruszkowy</smak>
			<ilosc>2000</ilosc>
			<cena>2.9000</cena>
			<kodyKreskowe>1234567890123 12345678</kodyKreskowe>
		</napoj>
		<napoj id="4" rodzaj="Sok">
			<nazwa>Fortuna</nazwa>
			<producent>Fortuna</producent>
			<dostawcaID>3</dostawcaID>
			<gaz>niegazowany</gaz>
			<smak>pomarańczowy</smak>
			<ilosc>1500</ilosc>
			<cena>3.1500</cena>
		</napoj>
		<napoj id="5" rodzaj="Sok">
			<nazwa>Fortuna</nazwa>
			<producent>Fortuna</producent>
			<dostawcaID>3</dostawcaID>
			<gaz>niegazowany</gaz>
			<smak>wieloowocowy</smak>
			<ilosc>1000</ilosc>
			<cena>3.2500</cena>
		</napoj>
		<napoj id="6" rodzaj="Sok">
			<nazwa>Fortuna</nazwa>
			<producent>Fortuna</producent>
			<dostawcaID>3</dostawcaID>
			<gaz>niegazowany</gaz>
			<smak>jabłko-marchew</smak>
			<ilosc>3000</ilosc>
			<cena>4.8000</cena>
		</napoj>
		<napoj id="7" rodzaj="Sok">
			<nazwa>Fortuna</nazwa>
			<producent>Fortuna</producent>
			<dostawcaID>3</dostawcaID>
			<gaz>niegazowany</gaz>
			<smak>truskawka-jabłko</smak>
			<ilosc>3000</ilosc>
			<cena>2.7000</cena>
		</napoj>
		<napoj id="8" rodzaj="Woda">
			<nazwa>Cisowianka</nazwa>
			<producent>Cisowianka</producent>
			<dostawcaID>3</dostawcaID>
			<gaz>niegazowany</gaz>
			<ilosc>4000</ilosc>
			<cena>1.7000</cena>
		</napoj>
		<napoj id="9" rodzaj="Woda">
			<nazwa>Cisowianka</nazwa>
			<producent>Cisowianka</producent>
			<dostawcaID>3</dostawcaID>
			<gaz>lekkogazowany</gaz>
			<ilosc>4000</ilosc>
			<cena>1.7000</cena>
		</napoj>
		<napoj id="10" rodzaj="Woda">
			<nazwa>Cisowianka</nazwa>
			<producent>Cisowianka</producent>
			<dostawcaID>3</dostawcaID>
			<gaz>gazowany</gaz>
			<ilosc>4000</ilosc>
			<cena>1.7000</cena>
		</napoj>
		<napoj id="11" rodzaj="Piwo">
			<nazwa>Tyskie</nazwa>
			<producent>Kompania Piwowarska</producent>
			<dostawcaID>4</dostawcaID>
			<gaz>gazowany</gaz>
			<ilosc>3000</ilosc>
			<cena>2.0000</cena>
		</napoj>
		<napoj id="12" rodzaj="Piwo">
			<nazwa>Lech</nazwa>
			<producent>Kompania Piwowarska</producent>
			<dostawcaID>4</dostawcaID>
			<gaz>gazowany</gaz>
			<ilosc>3200</ilosc>
			<cena>2.0000</cena>
		</napoj>
		<napoj id="13" rodzaj="Piwo">
			<nazwa>Tatra</nazwa>
			<producent>Grupa Żywiec</producent>
			<dostawcaID>4</dostawcaID>
			<gaz>gazowany</gaz>
			<ilosc>3200</ilosc>
			<cena>1.8000</cena>
		</napoj>
		<napoj id="14" rodzaj="Piwo">
			<nazwa>Tyskie</nazwa>
			<producent>Kompania Piwowarska</producent>
			<dostawcaID>4</dostawcaID>
			<gaz>gazowany</gaz>
			<ilosc>3000</ilosc>
			<cena>2.0000</cena>
		</napoj>
		<napoj id="15" rodzaj="Napój">
			<nazwa>Hoop Cola</nazwa>
			<producent>Hoop</producent>
			<dostawcaID>1</dostawcaID>
			<gaz>gazowany</gaz>
			<ilosc>2000</ilosc>
			<cena>3.0000</cena>
		</napoj>
		<napoj id="16" rodzaj="Piwo">
			<nazwa>Żywiec</nazwa>
			<producent>Grupa Żywiec</producent>
			<dostawcaID>4</dostawcaID>
			<gaz>gazowany</gaz>
			<ilosc>2000</ilosc>
			<cena>2.5000</cena>
		</napoj>
	</napoje>
	<dostawcy>
		<dostawca id="1">
			<imie>Bronisław</imie>
			<nazwisko>Komar</nazwisko>
			<email>bronek.komar@zywiec.pl</email>
			<numerTelefonu>634345342</numerTelefonu>
		</dostawca>
		<dostawca id="2">
			<imie>Paweł</imie>
			<nazwisko>Gaweł</nazwisko>
			<email>p.gawel@magazyny.pl</email>
			<numerTelefonu>876655342</numerTelefonu>
		</dostawca>
		<dostawca id="3">
			<imie>Kamil</imie>
			<nazwisko>Jeż</nazwisko>
			<email>jezyk.kamil@soki.pl</email>
			<numerTelefonu>634354335</numerTelefonu>
		</dostawca>
		<dostawca id="4">
			<imie>Jakub</imie>
			<nazwisko>Kirkiewicz</nazwisko>
			<email>jakub.kirki@hellmann.pl</email>
			<numerTelefonu>637567662</numerTelefonu>
		</dostawca>
		<dostawca id="5">
			<nazwa>SuperDostawy Sp. z.o.o</nazwa>
			<nip>1234567890</nip>
			<numerTelefonu>840285923</numerTelefonu>
		</dostawca>
	</dostawcy>
	<producenci>
		<producent>Fortuna</producent>
		<producent>Cisowianka</producent>
		<producent>Grupa Żywiec</producent>
		<producent>Kompania Piwowarska</producent>
		<producent>Hoop</producent>
		<producent>Maspex</producent>
		<producent>Pepsi</producent>
	</producenci>
	<rodzaje>
		<rodzaj podatek="0.05">Sok</rodzaj>
		<rodzaj>Napój</rodzaj>
		<rodzaj podatek="0.22">Napój_energetyczny</rodzaj>
		<rodzaj podatek="0.22">Piwo</rodzaj>
		<rodzaj podatek="0.22">Wódka</rodzaj>
		<rodzaj podatek="0.05">Nektar</rodzaj>
		<rodzaj podatek="0.22">Woda</rodzaj>
	</rodzaje>
</hurtownia>